product_id,product_fullName,product_url,product_name,product_cost,review_title,review_content,review_rating,review_date,review_location,review_likes,review_dislikes
itm0dbce56d4fdfa,intel-quad-core-q9550-2-8-ghz-lga-775-socket-4-cores-desktop-processor,https://www.flipkart.com/intel-quad-core-q9550-2-8-ghz-lga-775-socket-4-cores-desktop-processor/product-reviews/itm0dbce56d4fdfa?page=1,Intel Quad-core-Q9550,"4,999",Terrific purchase,Very good.The speed of my pc becomes double as compared to before.,5,"Jul, 2022", Cachar,5,2
itm0dbce56d4fdfa,intel-quad-core-q9550-2-8-ghz-lga-775-socket-4-cores-desktop-processor,https://www.flipkart.com/intel-quad-core-q9550-2-8-ghz-lga-775-socket-4-cores-desktop-processor/product-reviews/itm0dbce56d4fdfa?page=1,Intel Quad-core-Q9550,"4,999",Super!,VARY NICE PRODUCTS.....NEW PROCESSOR AND VARY GOOD WORKING....MY PC RUN FAST NOW.....NICE AND BEST PROCESSOR....THANKS FLIPKART 👍👍😍😍😍,5,"Dec, 2022", Loni,2,0
itm0dbce56d4fdfa,intel-quad-core-q9550-2-8-ghz-lga-775-socket-4-cores-desktop-processor,https://www.flipkart.com/intel-quad-core-q9550-2-8-ghz-lga-775-socket-4-cores-desktop-processor/product-reviews/itm0dbce56d4fdfa?page=1,Intel Quad-core-Q9550,"4,999",Terrific,"Genuine but used, Intel Quad-core 2.83 GHz CPU with 12MB cache, worked as a great performance enhancer, after BIOS upgrade to A11, for my old Dell Optiplex 330 desktop with LGA 775 socket, G31 GPU and DDR2 RAM. Thanks Flipkart",5,"Oct, 2022", Kolkata,2,0
itm0dbce56d4fdfa,intel-quad-core-q9550-2-8-ghz-lga-775-socket-4-cores-desktop-processor,https://www.flipkart.com/intel-quad-core-q9550-2-8-ghz-lga-775-socket-4-cores-desktop-processor/product-reviews/itm0dbce56d4fdfa?page=1,Intel Quad-core-Q9550,"4,999",Highly recommended,Working with zeb-g41 lga 775 motherboard,5,"Mar, 2023", Mirzapur,3,1
itm0dbce56d4fdfa,intel-quad-core-q9550-2-8-ghz-lga-775-socket-4-cores-desktop-processor,https://www.flipkart.com/intel-quad-core-q9550-2-8-ghz-lga-775-socket-4-cores-desktop-processor/product-reviews/itm0dbce56d4fdfa?page=1,Intel Quad-core-Q9550,"4,999",Super!,Paired it with GTX 1060 and GTA 5 runs 60+ FPSVery powerful processor! SSD is must have!,5,"Nov, 2022", Bangalore,1,1
itm0dbce56d4fdfa,intel-quad-core-q9550-2-8-ghz-lga-775-socket-4-cores-desktop-processor,https://www.flipkart.com/intel-quad-core-q9550-2-8-ghz-lga-775-socket-4-cores-desktop-processor/product-reviews/itm0dbce56d4fdfa?page=1,Intel Quad-core-Q9550,"4,999",Terrific purchase,Best product,5,"Jul, 2022", Gonda,2,1
itm0dbce56d4fdfa,intel-quad-core-q9550-2-8-ghz-lga-775-socket-4-cores-desktop-processor,https://www.flipkart.com/intel-quad-core-q9550-2-8-ghz-lga-775-socket-4-cores-desktop-processor/product-reviews/itm0dbce56d4fdfa?page=1,Intel Quad-core-Q9550,"4,999",Wonderful,Good product thank you,5,"Apr, 2022", Jatani,1,1
itm0dbce56d4fdfa,intel-quad-core-q9550-2-8-ghz-lga-775-socket-4-cores-desktop-processor,https://www.flipkart.com/intel-quad-core-q9550-2-8-ghz-lga-775-socket-4-cores-desktop-processor/product-reviews/itm0dbce56d4fdfa?page=1,Intel Quad-core-Q9550,"4,999",Perfect product!,First of all very good packaging by seller he stick so many layer plastic to processor not even single scratch of core in packing which is very goodI was using dual core e600 which was having 100°C + temp always and now I am using Q9550 witch is having 60° C very nice for regular use,5,"Aug, 2022", Ambikapur,0,0
itm0dbce56d4fdfa,intel-quad-core-q9550-2-8-ghz-lga-775-socket-4-cores-desktop-processor,https://www.flipkart.com/intel-quad-core-q9550-2-8-ghz-lga-775-socket-4-cores-desktop-processor/product-reviews/itm0dbce56d4fdfa?page=1,Intel Quad-core-Q9550,"4,999",Awesome,Works great,5,29 days ago, Chennai,0,0
itm0dbce56d4fdfa,intel-quad-core-q9550-2-8-ghz-lga-775-socket-4-cores-desktop-processor,https://www.flipkart.com/intel-quad-core-q9550-2-8-ghz-lga-775-socket-4-cores-desktop-processor/product-reviews/itm0dbce56d4fdfa?page=1,Intel Quad-core-Q9550,"4,999",Not recommended at all,This processor not property work. Weast for my money, ,3 months ago, Chikkamagaluru,0,0
itm0dbce56d4fdfa,intel-quad-core-q9550-2-8-ghz-lga-775-socket-4-cores-desktop-processor,https://www.flipkart.com/intel-quad-core-q9550-2-8-ghz-lga-775-socket-4-cores-desktop-processor/product-reviews/itm0dbce56d4fdfa?page=2,Intel Quad-core-Q9550,"4,999",Simply awesome,"Super product, it's performs faster and my old pc motherboard g31Handel this processor easily,so I am very thankful to seller 🙏 for this processor and thank to Flipkart.",5,10 months ago, Ludhiana,0,0
itm0dbce56d4fdfa,intel-quad-core-q9550-2-8-ghz-lga-775-socket-4-cores-desktop-processor,https://www.flipkart.com/intel-quad-core-q9550-2-8-ghz-lga-775-socket-4-cores-desktop-processor/product-reviews/itm0dbce56d4fdfa?page=2,Intel Quad-core-Q9550,"4,999",Delightful,Good product,3,11 months ago, Yavatmal,0,0
itm0dbce56d4fdfa,intel-quad-core-q9550-2-8-ghz-lga-775-socket-4-cores-desktop-processor,https://www.flipkart.com/intel-quad-core-q9550-2-8-ghz-lga-775-socket-4-cores-desktop-processor/product-reviews/itm0dbce56d4fdfa?page=2,Intel Quad-core-Q9550,"4,999",Wonderful,"Super, super,super!!!!!👍👍👍My old pc performs faster, thanks to flipkart and sellerMy old dg31pr motherboard handels this processor easily and there is no cpu heating issue...... I am requesting flipkart and this seller that please provide us higher version of this processor that is Q9650 at affordable price like this,then I will definitely buy another...... Thanks to flipkart and seller also, thank u🙏🙏🙏❤",5,"May, 2023", Malda,0,0
itm0dbce56d4fdfa,intel-quad-core-q9550-2-8-ghz-lga-775-socket-4-cores-desktop-processor,https://www.flipkart.com/intel-quad-core-q9550-2-8-ghz-lga-775-socket-4-cores-desktop-processor/product-reviews/itm0dbce56d4fdfa?page=2,Intel Quad-core-Q9550,"4,999",Terrific,Suprb processor ever.. works so perfect,5,"May, 2023", Badlapur,0,0
itm0dbce56d4fdfa,intel-quad-core-q9550-2-8-ghz-lga-775-socket-4-cores-desktop-processor,https://www.flipkart.com/intel-quad-core-q9550-2-8-ghz-lga-775-socket-4-cores-desktop-processor/product-reviews/itm0dbce56d4fdfa?page=2,Intel Quad-core-Q9550,"4,999",Super!,Excellent Performance Compared to core 2 duo,5,"Feb, 2023", Chirkunda,0,0
itm0dbce56d4fdfa,intel-quad-core-q9550-2-8-ghz-lga-775-socket-4-cores-desktop-processor,https://www.flipkart.com/intel-quad-core-q9550-2-8-ghz-lga-775-socket-4-cores-desktop-processor/product-reviews/itm0dbce56d4fdfa?page=2,Intel Quad-core-Q9550,"4,999",Could be way better,This processor made my pc faster. But lots of scratches and small damages in it's surface. Don't by second hand processors, ,"Sep, 2022", Kannapuram,1,0
itm0dbce56d4fdfa,intel-quad-core-q9550-2-8-ghz-lga-775-socket-4-cores-desktop-processor,https://www.flipkart.com/intel-quad-core-q9550-2-8-ghz-lga-775-socket-4-cores-desktop-processor/product-reviews/itm0dbce56d4fdfa?page=2,Intel Quad-core-Q9550,"4,999",Very Good,Best for mid range uses Best for Google all program or opera browser And this proccessor for nice formance pro,4,"Jul, 2022", Anuppur,0,0
itm0dbce56d4fdfa,intel-quad-core-q9550-2-8-ghz-lga-775-socket-4-cores-desktop-processor,https://www.flipkart.com/intel-quad-core-q9550-2-8-ghz-lga-775-socket-4-cores-desktop-processor/product-reviews/itm0dbce56d4fdfa?page=2,Intel Quad-core-Q9550,"4,999",Must buy!,Very nice processor for heavy task.System performance doubled. Good seller.Using for last 2 days.,5,"Apr, 2022", Harirampur,0,0
itm0dbce56d4fdfa,intel-quad-core-q9550-2-8-ghz-lga-775-socket-4-cores-desktop-processor,https://www.flipkart.com/intel-quad-core-q9550-2-8-ghz-lga-775-socket-4-cores-desktop-processor/product-reviews/itm0dbce56d4fdfa?page=2,Intel Quad-core-Q9550,"4,999",Worst experience ever!,After some use it's not working properly. BOD(blue screen oda death appears) worst product., ,"Mar, 2022", Aurangabad,2,2
itm0dbce56d4fdfa,intel-quad-core-q9550-2-8-ghz-lga-775-socket-4-cores-desktop-processor,https://www.flipkart.com/intel-quad-core-q9550-2-8-ghz-lga-775-socket-4-cores-desktop-processor/product-reviews/itm0dbce56d4fdfa?page=2,Intel Quad-core-Q9550,"4,999",Horrible,Damaged product pls don't buy any product flipkart .Totally weast money., ,"Mar, 2022", Malaut,10,8
